<?xml version="1.0" encoding="UTF-8"?>
<tibrules xmlns="exchange.tibco.com/tibreview" xmlns:xsi="http://www.w3.org/2001/XMLSchema-instance"
	xsi:schemaLocation="exchange.tibco.com/tibreview ../../main/resources/schemas/tibrules.xsd ">
	<process>

	</process>


	
	
	<resource>
		<rule name="RV Transport Certified Configuration resource configuration error" ruleset="TIBCO conventions" prority="3"
			description="RV Transport Certified resource configuration error.">
			<configuration type="rvsharedresource:RVResource" filter=" @rvType = 'Certified' " >
				<property name="daemon" check="configurable"/>
				<property name="network" check="configurable"/>
				<property name="service" check="configurable"/>
				<property name="cmName" check="configurable"/>
				<property name="ledgerFile" check="configurable"/>
				<property name="syncLedgerFile" check="configurable"/>
				<property name="relayAgent" check="configurable"/>
				<property name="msgTimeout" check="configurable"/>
				<property name="requireOldMsg" check="configurable"/>

			</configuration>
		</rule>
	</resource>

	<xpathfunctions>
		<xpathfunction id="process">/bpws:process</xpathfunction>
		<xpathfunction id="scope">/bpws:process/bpws:scope</xpathfunction>
		<xpathfunction id="flow">/bpws:process/bpws:scope/bpws:flow</xpathfunction>
		<xpathfunction id="extensionActivity">//bpws:extensionActivity</xpathfunction>
		<xpathfunction id="extActivity">//tibex:extActivity</xpathfunction>
		<xpathfunction id="activityExtension">//tibex:activityExtension</xpathfunction>
		<xpathfunction id="activityExtensionConfig">//tibex:config</xpathfunction>
		<xpathfunction id="processInfo">/bpws:process/tibex:ProcessInfo</xpathfunction>
		<xpathfunction id="receiveEvent">//bpws:extensionActivity/tibex:receiveEvent</xpathfunction>
		<xpathfunction id="eventSource">//bpws:extensionActivity/tibex:receiveEvent/tibex:eventSource</xpathfunction>
		<xpathfunction id="documentation">/bpws:process/bpws:documentation</xpathfunction>
		<xpathfunction id="reply">//bpws:reply</xpathfunction>
		<xpathfunction id="layoutConstraint">//layoutConstraint</xpathfunction>
		<xpathfunction id="diagram">//notation:Diagram</xpathfunction>
	</xpathfunctions>
</tibrules>